{
  "id": "ec12fc16-870b-4bdd-9cc0-2d51ff061ccb",
  "courseId": "course-001",
  "lectureId": "test-research",
  "presetId": "research-mode",
  "artifactType": "flashcards",
  "generatedAt": "2026-02-11T09:33:59.940541+00:00",
  "version": "0.2",
  "threadRefs": [
    "2c5e7d74-d171-4e8c-9dca-704c0ab9f42d",
    "b14644ae-ac3e-4093-ba7d-c94d03250d67",
    "02dcda68-b5ba-4465-9797-834087a28b27"
  ],
  "cards": [
    {
      "front": "What triggers the primary mechanism?",
      "back": "Activation of component A and input processing.",
      "difficulty": "easy",
      "tags": [
        "core-concepts"
      ],
      "threadRef": "b14644ae-ac3e-4093-ba7d-c94d03250d67"
    },
    {
      "front": "Why does optimization matter?",
      "back": "It enables enhanced process, increasing efficiency.",
      "difficulty": "medium",
      "tags": [
        "mechanisms"
      ]
    }
  ]
}
